{
  "$schema": "./schema/fundamentals.schema.json",
  "intro": "Reported, not confirmed: candidates describe a resume deep dive mixed with quick IT fundamentals checks. Say each answer out loud in about 30 seconds, then reveal and mark yourself honestly. Speed matters less than a clean, correct first sentence.",
  "pass_pct": 80,
  "status_options": [
    {
      "id": "new",
      "label": "New"
    },
    {
      "id": "shaky",
      "label": "Shaky"
    },
    {
      "id": "known",
      "label": "Known"
    }
  ],
  "topics": [
    {
      "id": "web",
      "name": "DNS and the request path"
    },
    {
      "id": "network",
      "name": "Networking"
    },
    {
      "id": "security",
      "name": "Security and encryption"
    },
    {
      "id": "compute",
      "name": "Compute and operating systems"
    },
    {
      "id": "data",
      "name": "Databases and data"
    },
    {
      "id": "architecture",
      "name": "Architecture patterns"
    },
    {
      "id": "storage",
      "name": "Storage"
    }
  ],
  "items": [
    {
      "id": "url-flow",
      "topic": "web",
      "q": "What happens when you type a URL into a browser and press Enter?",
      "a": "The browser resolves the hostname to an IP through DNS, opens a TCP connection, and does a TLS handshake for HTTPS. It sends an HTTP request, which may hit a CDN, then a load balancer, then an app server and its database. The response comes back and the browser renders the HTML, fetching CSS, JavaScript, and images the same way.",
      "followup": "Where would you look first if the page is slow, and how do you tell a DNS problem from a server problem?"
    },
    {
      "id": "dns-resolution",
      "topic": "web",
      "q": "How does DNS resolution work?",
      "a": "The client asks a recursive resolver. If the answer is not cached, the resolver asks a root server, which points to the TLD server for .com, which points to the authoritative name server for the domain. The authoritative server returns the record, and every layer caches it for the record's TTL.",
      "followup": "Why can a DNS change take a while to reach everyone?"
    },
    {
      "id": "dns-records",
      "topic": "web",
      "q": "A record vs CNAME vs Route 53 alias?",
      "a": "An A record maps a name to an IPv4 address, AAAA to IPv6. A CNAME maps a name to another name and cannot sit at the zone apex. A Route 53 alias points to an AWS resource such as a load balancer or CloudFront, works at the apex, and costs nothing per query for AWS targets.",
      "followup": "Why can you not put a CNAME on example.com itself?"
    },
    {
      "id": "osi-layers",
      "topic": "network",
      "q": "Walk through the networking layers.",
      "a": "The OSI model has seven layers: physical, data link, network, transport, session, presentation, application. In practice we use the TCP/IP model: link, internet (IP), transport (TCP or UDP), and application (HTTP, DNS). An ALB works at layer 7 and an NLB at layer 4.",
      "followup": "Which layer does a security group filter on?"
    },
    {
      "id": "tcp-udp",
      "topic": "network",
      "q": "TCP vs UDP?",
      "a": "TCP is connection-oriented: it guarantees ordered, reliable delivery with retransmission and congestion control, at the cost of latency. UDP just sends datagrams with no handshake or guarantee, so it is faster and lighter. Use TCP for web and databases, UDP for DNS lookups, video, voice, and games.",
      "followup": "HTTP/3 runs over UDP. How does it still stay reliable?"
    },
    {
      "id": "tcp-handshake",
      "topic": "network",
      "q": "What is the TCP three-way handshake?",
      "a": "The client sends SYN, the server replies SYN-ACK, and the client sends ACK. Both sides have now agreed on starting sequence numbers and the connection is open. Closing uses FIN and ACK from each side.",
      "followup": "Why do connection pools and keep-alive matter for latency?"
    },
    {
      "id": "http-basics",
      "topic": "web",
      "q": "Which HTTP methods are idempotent, and why does it matter?",
      "a": "GET, PUT, DELETE, and HEAD are idempotent: repeating them leaves the same result. POST is not, so retrying it can create duplicates. That matters because networks fail and clients retry, so for POST you add an idempotency key the server uses to ignore repeats.",
      "followup": "How would you make a payment API safe to retry?"
    },
    {
      "id": "http-status",
      "topic": "web",
      "q": "HTTP status code families, and 502 vs 504?",
      "a": "2xx success, 3xx redirect, 4xx client error such as 401, 403, 404, 429, and 5xx server error. A 502 Bad Gateway means the proxy got an invalid response from the backend. A 504 Gateway Timeout means the backend did not answer in time.",
      "followup": "An ALB returns 504s. What do you check?"
    },
    {
      "id": "http-versions",
      "topic": "web",
      "q": "HTTP/1.1 vs HTTP/2 vs HTTP/3?",
      "a": "HTTP/1.1 sends one request at a time per connection. HTTP/2 multiplexes many streams over one TCP connection with header compression, but a lost packet still blocks all streams. HTTP/3 runs over QUIC on UDP, so streams recover independently and setup is faster.",
      "followup": "Why does HTTP/3 help on mobile networks?"
    },
    {
      "id": "tls-handshake",
      "topic": "security",
      "q": "How does a TLS handshake work?",
      "a": "The client and server agree on a TLS version and cipher, the server presents its certificate, and the client checks it against trusted certificate authorities and the hostname. They then use asymmetric key exchange to agree on a shared session key. Everything after that is encrypted with fast symmetric encryption.",
      "followup": "What breaks if the certificate's hostname does not match?"
    },
    {
      "id": "sym-asym",
      "topic": "security",
      "q": "Symmetric vs asymmetric encryption?",
      "a": "Symmetric encryption uses one shared key to encrypt and decrypt; it is fast, AES is the example. Asymmetric uses a public and private key pair; anyone can encrypt with the public key, only the private key decrypts, and it also enables signatures. It is slow, so TLS uses asymmetric only to exchange a symmetric session key.",
      "followup": "Where does KMS envelope encryption fit?"
    },
    {
      "id": "hash-encrypt",
      "topic": "security",
      "q": "Hashing vs encryption?",
      "a": "Encryption is reversible with the key; hashing is one way. You encrypt data you need to read back, and you hash things you only need to verify, like passwords, using a slow salted hash such as bcrypt or Argon2.",
      "followup": "Why is a fast hash like SHA-256 a poor choice for passwords?"
    },
    {
      "id": "rest-transit",
      "topic": "security",
      "q": "Encryption at rest vs in transit?",
      "a": "At rest protects stored data on disks, S3, and backups, usually with KMS keys. In transit protects data moving over the network, usually with TLS. You need both, plus access control, because encryption does not stop an authorized but compromised identity.",
      "followup": "Who can decrypt an S3 object encrypted with a KMS key?"
    },
    {
      "id": "authn-authz",
      "topic": "security",
      "q": "Authentication vs authorization?",
      "a": "Authentication proves who you are: password, MFA, SSO. Authorization decides what you are allowed to do once known: IAM policies, roles, permissions. A 401 is a failed authentication; a 403 is an authenticated user who is not allowed.",
      "followup": "How does an IAM role combine the two?"
    },
    {
      "id": "least-privilege",
      "topic": "security",
      "q": "What is least privilege, and how do you apply it on AWS?",
      "a": "Give each identity only the actions and resources it needs, nothing more. On AWS that means roles with temporary credentials, scoped IAM policies, SCPs as guardrails, and reviewing unused permissions with IAM Access Analyzer.",
      "followup": "How do you grant a Lambda function access to exactly one S3 prefix?"
    },
    {
      "id": "containers-vms",
      "topic": "compute",
      "q": "Containers vs virtual machines?",
      "a": "A VM virtualizes hardware and runs its own full operating system on a hypervisor, so it is heavier and slower to boot but strongly isolated. A container shares the host kernel and packages only the app and its dependencies, so it starts in seconds and packs densely. On AWS, EC2 is the VM and ECS or EKS run containers.",
      "followup": "When would you still pick a VM over a container?"
    },
    {
      "id": "process-thread",
      "topic": "compute",
      "q": "Process vs thread?",
      "a": "A process has its own memory space; threads run inside a process and share its memory. Threads are cheaper to create and communicate faster, but shared memory needs locks to avoid race conditions.",
      "followup": "Why does Python's GIL push CPU-bound work toward multiple processes?"
    },
    {
      "id": "scale-up-out",
      "topic": "architecture",
      "q": "Vertical vs horizontal scaling?",
      "a": "Vertical scaling means a bigger machine: simple, but it has a ceiling and a single point of failure. Horizontal scaling means more machines behind a load balancer: near-unlimited and fault tolerant, but the app must be stateless or share state externally.",
      "followup": "What has to change in an app before you can scale it horizontally?"
    },
    {
      "id": "stateful-stateless",
      "topic": "architecture",
      "q": "Stateful vs stateless services?",
      "a": "A stateless service keeps no client data between requests, so any instance can serve any request and you scale by adding instances. A stateful service keeps session or data locally, so requests must return to the same node and scaling or failover is harder. Push state out to a database, cache, or token so the app tier can be stateless.",